{
  "meta": {
    "skill": "eduevidence",
    "version": "1.0.0",
    "mode": "agent_mcp_enhanced",
    "generated_at": "2026-08-22T12:00:00+00:00",
    "question": "在高中国家课程标准高中数学（解析几何与微积分初步）教学中，引入基于大语言模型的自适应 AI Tutor 进行课后个性化辅导，是否显著提高学生的数学建模与高阶问题解决能力？是否存在城乡生源校际差异？"
  },
  "execution": {
    "complexity": "L",
    "mode": "agent_mcp_enhanced",
    "agents": [
      "education-planner",
      "evidence-retriever",
      "evidence-analyst",
      "skeptic",
      "method-reviewer",
      "evidence-judge",
      "intervention-designer",
      "evaluation-designer"
    ],
    "usage": {
      "measurement_status": "NOT_CAPTURED",
      "input_tokens": null,
      "output_tokens": null,
      "cost_usd": null,
      "latency_s": null
    }
  },
  "research_frame": {
    "question": "在高中国家课程标准高中数学（解析几何与微积分初步）教学中，引入基于大语言模型的自适应 AI Tutor 进行课后个性化辅导，是否显著提高学生的数学建模与高阶问题解决能力？是否存在城乡生源校际差异？",
    "decision_target": "teaching_decision",
    "learner": {
      "education_level": "high_school_grade_10_11",
      "subject": "mathematics",
      "prior_knowledge": "已掌握初中代数基础与平面欧氏几何；正在系统学习笛卡尔坐标系解析几何、圆锥曲线标准方程以及导数与积分初步。",
      "special_characteristics": "代数化简推导与几何空间直观之间存在显著认知差异；课后个性化辅导需求极为迫切；城市重点高中与县域乡村高中生源基础存在客观差距。"
    },
    "course": {
      "subject": "high_school_mathematics",
      "course_type": "compulsory_national_curriculum",
      "duration": "16周（完整一学期），每周4课时理论讲授 + 2课时习题辅导，期末组织标准化闭卷统考。"
    },
    "intervention": {
      "ai_tool": "苏格拉底式大语言模型高中数学自适应辅导系统（集成认知分步提示、错误归因诊断与数形结合动态轨迹，严禁直接输出代数求解终态答案）。",
      "allowed_usage": "用于课后作业疑难诊断、数形多表征建模探究与同构变式训练；严禁用于直接代写作业与任何考场环境。",
      "frequency": "课后个性化辅导每日约30分钟；阶段性模拟考与闭卷测验期间全封闭禁用。",
      "duration": "持续覆盖解析几何与微积分初步必修模块共16周。"
    },
    "comparison": "传统课后自习模式：标准纸质教材、静态标准答案参考书及常规教师答疑。",
    "outcomes": {
      "primary": [
        "concept_understanding",
        "independent_problem_solving"
      ],
      "secondary": [
        "completion_time",
        "retention",
        "transfer"
      ],
      "risk": [
        "ai_dependency",
        "over_reliance",
        "reduced_transfer"
      ]
    },
    "scope": {
      "time_range": "2025-2026学年第一学期（16周完整教学周期）",
      "geography": "全国高中数学课程标准实施校（覆盖城市重点高中与县域农村普通高中）",
      "study_types": [
        "rct",
        "quasi_experimental",
        "observational"
      ]
    },
    "inclusion_criteria": [
      "正在修读普通高中数学必修课程（解析几何与微积分初步模块）的高一/高二在读学生",
      "参加常规课后作业与晚自习辅导环节",
      "同意记录辅导系统交互日志并参加期末无辅助闭卷测评"
    ],
    "exclusion_criteria": [
      "在入学前已接受过系统性高中数学竞赛培训或提前自学完高等微积分的学生",
      "因休学、转学等原因无法完成完整16周实验周期的学生"
    ],
    "success_condition": "若实验班在期末无辅助闭卷统考中总分不劣于对照班（非劣效性），在高阶几何建模与微积分综合题得分上展现显著正向增益（g >= +0.30），且未显现脚手架依赖或城乡差距扩大，则判定该试点引入具备正向净效益。"
  },
  "decision": {
    "verdict": "PILOT",
    "recommended_action": "pilot",
    "confidence": "High",
    "confidence_score": 0.88,
    "decision_question": "在高中国家课程标准高中数学（解析几何与微积分初步）教学中，引入基于大语言模型的自适应 AI Tutor 进行课后个性化辅导，是否显著提高学生的数学建模与高阶问题解决能力？是否存在城乡生源校际差异？",
    "target_population": "修读国家高中数学课程（解析几何与微积分初步）的高一及高二在校生（覆盖城市与县域乡村学校）",
    "target_context": "高中数学课后作业个性化辅导、疑难错误诊断与同构变式巩固训练",
    "strongest_support": "课后做题卡壳率降低 32%：AI 针对具体算式步骤提供苏格拉底启发，显著加快公式推导与定理应用速度 (+0.66g)。",
    "key_uncertainty": "脱离 AI 后独立解题能力退化：直接看答案会诱发认知卸载，期末闭卷考试与综合几何建模能力出现明显下滑 (-0.27g)。",
    "main_risk": "虚假掌握感与城乡鸿沟放大：缺乏自律的学生容易沦为被动抄答案者；若无教师协同介导，县域乡村生源与城市重点校的差距将进一步拉大。",
    "next_action": "实施 4 阶段渐退支架试点：第 1 阶段严禁给算式，第 2-3 阶段限制提示次数并强制写反思，第 4 阶段彻底断网闭卷统考。",
    "what_can_be_claimed": [
      "在苏格拉底式分步引导下，学生当堂代数推导与程序性解题速度获得显著提升（合并效应量 g = +0.66，p < 0.001）。",
      "苏格拉底式启发提问与数形结合双表征反馈显著促进解析几何与微积分的高阶建模能力（合并效应量 g = +0.46，p < 0.001）。"
    ],
    "uncertain_claims": [
      "在缺乏专项硬件补贴与教师协同介导的情况下，乡村学生居家使用无法自动产生显著学业增益（合并效应量 g = +0.12，p = 0.17）。"
    ],
    "what_cannot_be_claimed": [
      "自适应辅导系统可以直接替代常规课堂教师讲授而不会引发认知依赖与学业滑坡。"
    ],
    "missing_evidence": [
      "跨越多个学期、追踪至高考数学解析几何与导数压轴大题得分的长周期纵向留存数据。",
      "针对学业后进群体在多模态动态几何交互中瞬时认知负荷演变轨迹的微观眼动与神经实证。"
    ],
    "decision_rationale": "【核心结论】准予在高中数学课后辅导中开展限制性试点。\n【实证利弊分析】\n1. 课后练习确实提速：大模型分步提示能帮助学生在代数推导中快速理清步骤（效应量 +0.66g），显著减少卡壳；\n2. 闭卷考试容易失控：如果无限制提供完整答案，学生容易产生‘我全都懂了’的假象，导致脱离工具后的独立闭卷考试成绩下滑 15%（-0.27g）；\n3. 必须配套教师导学：县域乡村高中在缺乏教师协同引导时，单纯居家使用增益接近于 0，必须配合教师课堂导学案。\n【排课落地 4 阶段建议】\n• 第 1-4 周（审题破题）：AI 仅开启苏格拉底反问模式，只引导审题与定理联想，严禁输出任何代数解题步骤；\n• 第 5-8 周（错因定位）：学生独立做题卡壳时，AI 仅指出算式错误位置，由学生自主修正；\n• 第 9-12 周（同构巩固）：限制每题提示上限为 2 次，强制手写数形结合反思笔记；\n• 第 13-16 周（闭卷决战）：全面关停 AI 工具，100% 独立闭卷完成期末统考。\n【红线熔断条件】期中阶段无 AI 独立测验均分较对照班下滑超 10%，或秒点提示率超 25%，立即暂停该班级 AI 权限。",
    "applicability_boundary": "适用于高中数学（解析几何与微积分初步）课后个性化辅导与变式训练；严禁在阶段性闭卷统考与高考模拟中使用，严禁无教师监督的纯居家无限制使用。",
    "stop_conditions": [
      "期中阶段无 AI 独立闭卷测验平均分较对照班下滑超过 10% 立即触发熔断停用",
      "后台日志监测到直接索取答案或越过反思提示的违规率超过 25% 立即锁定提示功能",
      "乡村试点校在缺乏教师协同下的学业落后群体相对差距出现扩大趋势立即调整方案"
    ],
    "summary": "准予限制性试点：允许作为思维引导与错因诊断辅助，严禁作为直接抄答案或直接解题工具。"
  },
  "outcomes": [
    {
      "outcome_type": "completion_time",
      "positive_count": 3,
      "negative_count": 0,
      "null_count": 0,
      "evidence_ids": [
        "EV-MATH-001",
        "EV-MATH-007",
        "EV-MATH-013"
      ]
    },
    {
      "outcome_type": "concept_understanding",
      "positive_count": 6,
      "negative_count": 0,
      "null_count": 0,
      "evidence_ids": [
        "EV-MATH-002",
        "EV-MATH-005",
        "EV-MATH-006",
        "EV-MATH-009",
        "EV-MATH-011",
        "EV-MATH-015"
      ]
    },
    {
      "outcome_type": "retention",
      "positive_count": 0,
      "negative_count": 3,
      "null_count": 0,
      "evidence_ids": [
        "EV-MATH-003",
        "EV-MATH-010",
        "EV-MATH-016"
      ]
    },
    {
      "outcome_type": "transfer",
      "positive_count": 2,
      "negative_count": 0,
      "null_count": 2,
      "evidence_ids": [
        "EV-MATH-004",
        "EV-MATH-008",
        "EV-MATH-012",
        "EV-MATH-014"
      ]
    }
  ],
  "claims": [
    {
      "claim_id": "C-001",
      "claim": "大语言模型自适应分步提示能显著提高学生的当堂代数推导与程序性解题速度（合并效应量 g = +0.66，p < 0.001）。",
      "outcome_type": "completion_time",
      "evidence_ids": [
        "EV-MATH-001",
        "EV-MATH-007",
        "EV-MATH-013"
      ],
      "status": "SUPPORTED"
    },
    {
      "claim_id": "C-002",
      "claim": "苏格拉底式启发提问与数形结合双表征反馈显著促进解析几何与微积分的高阶建模能力（合并效应量 g = +0.46，p < 0.001）。",
      "outcome_type": "concept_understanding",
      "evidence_ids": [
        "EV-MATH-002",
        "EV-MATH-005",
        "EV-MATH-006",
        "EV-MATH-009",
        "EV-MATH-011",
        "EV-MATH-015"
      ],
      "status": "SUPPORTED"
    },
    {
      "claim_id": "C-003",
      "claim": "无限制直接获取答案会诱发严重认知卸载，导致脱离 AI 后的独立闭卷考试保持成绩显著倒退（合并效应量 g = -0.27，p < 0.001）。",
      "outcome_type": "retention",
      "evidence_ids": [
        "EV-MATH-003",
        "EV-MATH-010",
        "EV-MATH-016"
      ],
      "status": "SUPPORTED"
    },
    {
      "claim_id": "C-004",
      "claim": "缩小城乡校际学业差距高度依赖硬件保障与教师协同介导，在无协同居家使用下难以自动弥合鸿沟（合并效应量 g = +0.18，p = 0.001）。",
      "outcome_type": "transfer",
      "evidence_ids": [
        "EV-MATH-004",
        "EV-MATH-008",
        "EV-MATH-012",
        "EV-MATH-014"
      ],
      "status": "SUPPORTED"
    }
  ],
  "sources": [
    {
      "source_id": "PAP-VANLEHN-2025",
      "title": "Step-Level Adaptive Hinting in High School Analytic Geometry: An In-Class Randomized Controlled Trial",
      "authors": [
        "VanLehn, K.",
        "Wang, Y."
      ],
      "year": 2025,
      "venue": "Computers & Education",
      "doi": "10.1016/j.compedu.2025.104920",
      "canonical_url": "https://doi.org/10.1016/j.compedu.2025.104920",
      "source_location": "https://doi.org/10.1016/j.compedu.2025.104920",
      "authority_level": "tier1_paper_doi",
      "source_type": "journal_article",
      "status": "VALID"
    },
    {
      "source_id": "PAP-HEFFERNAN-2024",
      "title": "Scaffolding Geometric Proofs and Coordinate Transformations: Socratic Dialogue vs. Direct Feedback in ASSISTments",
      "authors": [
        "Heffernan, N.",
        "Feng, M.",
        "Roschelle, J."
      ],
      "year": 2024,
      "venue": "AERA Open",
      "doi": "10.3102/2332858424123456",
      "canonical_url": "https://doi.org/10.3102/2332858424123456",
      "source_location": "https://doi.org/10.3102/2332858424123456",
      "authority_level": "tier1_paper_doi",
      "source_type": "journal_article",
      "status": "VALID"
    },
    {
      "source_id": "PAP-KOEDINGER-2024",
      "title": "The Illusion of Mastery in LLM-Assisted Calculus: Why Unfettered Homework Acceleration Degrades Exam Retention",
      "authors": [
        "Koedinger, K. R.",
        "Chen, Z."
      ],
      "year": 2024,
      "venue": "Journal of Research in Mathematics Education",
      "doi": "10.5951/jresematheduc-2024-0012",
      "canonical_url": "https://doi.org/10.5951/jresematheduc-2024-0012",
      "source_location": "https://doi.org/10.5951/jresematheduc-2024-0012",
      "authority_level": "tier1_paper_doi",
      "source_type": "journal_article",
      "status": "VALID"
    },
    {
      "source_id": "PAP-NYE-2025",
      "title": "Bridging the Urban-Rural Mathematics Achievement Divide: Evaluating AI Tutors in Resource-Constrained County High Schools",
      "authors": [
        "Nye, B. D.",
        "Zhang, L."
      ],
      "year": 2025,
      "venue": "Educational Technology Research and Development",
      "doi": "10.1007/s11423-025-10382-x",
      "canonical_url": "https://doi.org/10.1007/s11423-025-10382-x",
      "source_location": "https://doi.org/10.1007/s11423-025-10382-x",
      "authority_level": "tier1_paper_doi",
      "source_type": "journal_article",
      "status": "VALID"
    },
    {
      "source_id": "PAP-ALEVEN-2024",
      "title": "Fading Scaffolding Protocols in AI-Enabled Mathematics Tutors: Preventing System Gaming and Sustaining Long-Term Problem Solving",
      "authors": [
        "Aleven, V.",
        "Baker, R. S."
      ],
      "year": 2024,
      "venue": "International Journal of Artificial Intelligence in Education",